{
  "atom_scope": "heavy",
  "atoms": [
    {
      "altloc": "",
      "bfactor": 10.0,
      "chain_id": "A",
      "charge": "",
      "element": "N",
      "icode": "",
      "metadata": {},
      "model": null,
      "name": "N",
      "occupancy": 1.0,
      "record_name": "ATOM",
      "resname": "ALA",
      "resseq": 1,
      "serial": 1,
      "x": 0.0,
      "y": 0.0,
      "z": 0.0
    },
    {
      "altloc": "",
      "bfactor": 10.0,
      "chain_id": "A",
      "charge": "",
      "element": "C",
      "icode": "",
      "metadata": {},
      "model": null,
      "name": "CA",
      "occupancy": 1.0,
      "record_name": "ATOM",
      "resname": "ALA",
      "resseq": 1,
      "serial": 3,
      "x": 1.458,
      "y": 0.0,
      "z": 0.0
    },
    {
      "altloc": "",
      "bfactor": 10.0,
      "chain_id": "A",
      "charge": "",
      "element": "C",
      "icode": "",
      "metadata": {},
      "model": null,
      "name": "C",
      "occupancy": 1.0,
      "record_name": "ATOM",
      "resname": "ALA",
      "resseq": 1,
      "serial": 5,
      "x": 1.996,
      "y": 1.427,
      "z": 0.0
    },
    {
      "altloc": "",
      "bfactor": 10.0,
      "chain_id": "A",
      "charge": "",
      "element": "O",
      "icode": "",
      "metadata": {},
      "model": null,
      "name": "O",
      "occupancy": 1.0,
      "record_name": "ATOM",
      "resname": "ALA",
      "resseq": 1,
      "serial": 6,
      "x": 1.289,
      "y": 2.421,
      "z": 0.0
    },
    {
      "altloc": "",
      "bfactor": 10.0,
      "chain_id": "A",
      "charge": "",
      "element": "C",
      "icode": "",
      "metadata": {},
      "model": null,
      "name": "CB",
      "occupancy": 1.0,
      "record_name": "ATOM",
      "resname": "ALA",
      "resseq": 1,
      "serial": 7,
      "x": 2.09,
      "y": -0.76,
      "z": -1.12
    }
  ],
  "disulfide_bonds": [],
  "format": "pheat.atom-structure",
  "metadata": {
    "dropped_hydrogen_count": 2,
    "hydrogen_policy": "dropped",
    "preserved_hydrogen_count": 0,
    "source": "pdb",
    "warnings": [
      "dropped 2 hydrogen atoms from all-atom PDB input"
    ]
  },
  "name": "all_atom_tiny.pdb",
  "version": 1
}
