{
  "atom_scope": "heavy",
  "atoms": [
    {
      "altloc": "",
      "bfactor": 0.0,
      "chain_id": "A",
      "charge": "",
      "element": "N",
      "icode": "",
      "metadata": {},
      "model": null,
      "name": "N",
      "occupancy": 1.0,
      "record_name": "ATOM",
      "resname": "ALA",
      "resseq": 1,
      "serial": 1,
      "x": 0.0,
      "y": 0.0,
      "z": 0.0
    },
    {
      "altloc": "",
      "bfactor": 0.0,
      "chain_id": "A",
      "charge": "",
      "element": "C",
      "icode": "",
      "metadata": {},
      "model": null,
      "name": "CA",
      "occupancy": 1.0,
      "record_name": "ATOM",
      "resname": "ALA",
      "resseq": 1,
      "serial": 2,
      "x": 1.458,
      "y": 0.0,
      "z": 0.0
    },
    {
      "altloc": "",
      "bfactor": 0.0,
      "chain_id": "A",
      "charge": "",
      "element": "C",
      "icode": "",
      "metadata": {},
      "model": null,
      "name": "C",
      "occupancy": 1.0,
      "record_name": "ATOM",
      "resname": "ALA",
      "resseq": 1,
      "serial": 3,
      "x": 2.009477469375,
      "y": 1.421793796854,
      "z": 0.0
    },
    {
      "altloc": "",
      "bfactor": 0.0,
      "chain_id": "A",
      "charge": "",
      "element": "O",
      "icode": "",
      "metadata": {},
      "model": null,
      "name": "O",
      "occupancy": 1.0,
      "record_name": "ATOM",
      "resname": "ALA",
      "resseq": 1,
      "serial": 4,
      "x": 2.934498539788,
      "y": 1.739081009049,
      "z": 0.747680308869
    },
    {
      "altloc": "",
      "bfactor": 0.0,
      "chain_id": "A",
      "charge": "",
      "element": "C",
      "icode": "",
      "metadata": {},
      "model": null,
      "name": "CB",
      "occupancy": 1.0,
      "record_name": "ATOM",
      "resname": "ALA",
      "resseq": 1,
      "serial": 5,
      "x": 1.993817293327,
      "y": -0.770008608662,
      "z": -1.208671407273
    },
    {
      "altloc": "",
      "bfactor": 0.0,
      "chain_id": "A",
      "charge": "",
      "element": "N",
      "icode": "",
      "metadata": {},
      "model": null,
      "name": "N",
      "occupancy": 1.0,
      "record_name": "ATOM",
      "resname": "GLY",
      "resseq": 2,
      "serial": 6,
      "x": 1.435534940509,
      "y": 2.273764965645,
      "z": -0.843193987827
    },
    {
      "altloc": "",
      "bfactor": 0.0,
      "chain_id": "A",
      "charge": "",
      "element": "C",
      "icode": "",
      "metadata": {},
      "model": null,
      "name": "CA",
      "occupancy": 1.0,
      "record_name": "ATOM",
      "resname": "GLY",
      "resseq": 2,
      "serial": 7,
      "x": 1.868230225355,
      "y": 3.662568307544,
      "z": -0.942007286534
    },
    {
      "altloc": "",
      "bfactor": 0.0,
      "chain_id": "A",
      "charge": "",
      "element": "C",
      "icode": "",
      "metadata": {},
      "model": null,
      "name": "C",
      "occupancy": 1.0,
      "record_name": "ATOM",
      "resname": "GLY",
      "resseq": 2,
      "serial": 8,
      "x": 1.711292806558,
      "y": 4.385308036401,
      "z": 0.391650439763
    },
    {
      "altloc": "",
      "bfactor": 0.0,
      "chain_id": "A",
      "charge": "",
      "element": "O",
      "icode": "",
      "metadata": {},
      "model": null,
      "name": "O",
      "occupancy": 1.0,
      "record_name": "ATOM",
      "resname": "GLY",
      "resseq": 2,
      "serial": 9,
      "x": 2.608074257871,
      "y": 5.107943950883,
      "z": 0.826324298744
    }
  ],
  "disulfide_bonds": [],
  "format": "pheat.atom-structure",
  "metadata": {
    "geometry_note": "idealized approximate heavy-atom geometry",
    "source": "residue_geometry_reconstruction"
  },
  "name": "sequence:AG",
  "version": 1
}
