{
  "atom_scope": "heavy",
  "atoms": [
    {
      "altloc": "",
      "bfactor": 10.0,
      "chain_id": "A",
      "charge": "",
      "element": "N",
      "icode": "",
      "metadata": {},
      "model": null,
      "name": "N",
      "occupancy": 1.0,
      "record_name": "ATOM",
      "resname": "ALA",
      "resseq": 1,
      "serial": 1,
      "x": 0.0,
      "y": 0.0,
      "z": 0.0
    },
    {
      "altloc": "",
      "bfactor": 10.0,
      "chain_id": "A",
      "charge": "",
      "element": "C",
      "icode": "",
      "metadata": {},
      "model": null,
      "name": "CA",
      "occupancy": 1.0,
      "record_name": "ATOM",
      "resname": "ALA",
      "resseq": 1,
      "serial": 2,
      "x": 1.458,
      "y": 0.0,
      "z": 0.0
    },
    {
      "altloc": "",
      "bfactor": 10.0,
      "chain_id": "A",
      "charge": "",
      "element": "C",
      "icode": "",
      "metadata": {},
      "model": null,
      "name": "C",
      "occupancy": 1.0,
      "record_name": "ATOM",
      "resname": "ALA",
      "resseq": 1,
      "serial": 3,
      "x": 1.996,
      "y": 1.427,
      "z": 0.0
    },
    {
      "altloc": "",
      "bfactor": 10.0,
      "chain_id": "A",
      "charge": "",
      "element": "O",
      "icode": "",
      "metadata": {},
      "model": null,
      "name": "O",
      "occupancy": 1.0,
      "record_name": "ATOM",
      "resname": "ALA",
      "resseq": 1,
      "serial": 4,
      "x": 1.289,
      "y": 2.421,
      "z": 0.0
    },
    {
      "altloc": "A",
      "bfactor": 10.0,
      "chain_id": "A",
      "charge": "",
      "element": "C",
      "icode": "",
      "metadata": {},
      "model": null,
      "name": "CB",
      "occupancy": 0.6,
      "record_name": "ATOM",
      "resname": "ALA",
      "resseq": 1,
      "serial": 5,
      "x": 2.09,
      "y": -0.76,
      "z": -1.12
    },
    {
      "altloc": "B",
      "bfactor": 10.0,
      "chain_id": "A",
      "charge": "",
      "element": "C",
      "icode": "",
      "metadata": {},
      "model": null,
      "name": "CB",
      "occupancy": 0.4,
      "record_name": "ATOM",
      "resname": "ALA",
      "resseq": 1,
      "serial": 6,
      "x": 2.12,
      "y": -0.82,
      "z": 1.08
    },
    {
      "altloc": "",
      "bfactor": 10.0,
      "chain_id": "A",
      "charge": "",
      "element": "N",
      "icode": "",
      "metadata": {},
      "model": null,
      "name": "N",
      "occupancy": 1.0,
      "record_name": "ATOM",
      "resname": "GLY",
      "resseq": 2,
      "serial": 7,
      "x": 3.3,
      "y": 1.52,
      "z": 0.0
    },
    {
      "altloc": "",
      "bfactor": 10.0,
      "chain_id": "A",
      "charge": "",
      "element": "C",
      "icode": "",
      "metadata": {},
      "model": null,
      "name": "CA",
      "occupancy": 1.0,
      "record_name": "ATOM",
      "resname": "GLY",
      "resseq": 2,
      "serial": 8,
      "x": 3.92,
      "y": 2.83,
      "z": 0.0
    },
    {
      "altloc": "",
      "bfactor": 10.0,
      "chain_id": "A",
      "charge": "",
      "element": "C",
      "icode": "",
      "metadata": {},
      "model": null,
      "name": "C",
      "occupancy": 1.0,
      "record_name": "ATOM",
      "resname": "GLY",
      "resseq": 2,
      "serial": 9,
      "x": 5.44,
      "y": 2.7,
      "z": 0.0
    },
    {
      "altloc": "",
      "bfactor": 10.0,
      "chain_id": "A",
      "charge": "",
      "element": "O",
      "icode": "",
      "metadata": {},
      "model": null,
      "name": "O",
      "occupancy": 1.0,
      "record_name": "ATOM",
      "resname": "GLY",
      "resseq": 2,
      "serial": 10,
      "x": 6.05,
      "y": 3.75,
      "z": 0.0
    },
    {
      "altloc": "",
      "bfactor": 20.0,
      "chain_id": "B",
      "charge": "",
      "element": "O",
      "icode": "",
      "metadata": {},
      "model": null,
      "name": "O",
      "occupancy": 1.0,
      "record_name": "HETATM",
      "resname": "HOH",
      "resseq": 1,
      "serial": 11,
      "x": 9.0,
      "y": 9.0,
      "z": 9.0
    },
    {
      "altloc": "",
      "bfactor": 30.0,
      "chain_id": "C",
      "charge": "",
      "element": "ZN",
      "icode": "",
      "metadata": {},
      "model": null,
      "name": "ZN",
      "occupancy": 1.0,
      "record_name": "HETATM",
      "resname": "ZN",
      "resseq": 1,
      "serial": 12,
      "x": -3.0,
      "y": 1.0,
      "z": 0.0
    }
  ],
  "disulfide_bonds": [],
  "format": "pheat.atom-structure",
  "metadata": {
    "dropped_hydrogen_count": 0,
    "hydrogen_policy": "none-present",
    "preserved_hydrogen_count": 0,
    "source": "pdb",
    "warnings": []
  },
  "name": "tiny.pdb",
  "version": 1
}
